<?xml version="1.0" encoding="UTF-8"?>
<xs:schema attributeFormDefault="unqualified" elementFormDefault="qualified" xmlns:xs="http://www.w3.org/2001/XMLSchema">
    <xs:element name="liga" type="tipo_liga"/>
    <xs:complexType name="tipo_liga">
        <xs:sequence>
            <xs:element type="tipo_jornada" name="jornada"/>
        </xs:sequence>
    </xs:complexType>
    <xs:complexType name="tipo_jornada">
        <xs:sequence>
            <xs:element type="tipo_partido" name="partido"/>
        </xs:sequence>
        <xs:attribute type="xs:string" name="codigoJornada"/>
        <xs:attribute type="xs:string" name="fechaI"/>
        <xs:attribute type="xs:string" name="fechaF"/>
    </xs:complexType>
    <xs:complexType name="tipo_partido">
        <xs:sequence>
            <xs:element type="xs:string" name="resultado"/>
        </xs:sequence>
        <xs:attribute type="xs:string" name="equipo_local"/>
        <xs:attribute type="xs:string" name="equipo_visitante"/>
      </xs:complexType>
</xs:schema>