<?xml version="1.0" encoding="UTF-8"?>
<liga xmlns:xsi="http://www.w3.org/2001/XMLSchema-instance" xsi:noNamespaceSchemaLocation="BDD(Jornadas).xsd">
    <jornada codigoJornada="1" fechaFinal="20-11-2018" fechaInicio="10-10-2018">
        <partido equipo1="1" equipo2="2">
            <resultado>10-20</resultado>
        </partido>
        <partido equipo1="3" equipo2="4">
            <resultado>30-20</resultado>
        </partido>
        <partido equipo1="3" equipo2="4">
            <resultado>30-20</resultado>
        </partido>
        <partido equipo1="3" equipo2="4">
            <resultado>30-20</resultado>
        </partido>
    </jornada>
    <jornada codigoJornada="2" fechaFinal="20-11-2018" fechaInicio="10-10-2018">
        <partido equipo1="3" equipo2="4">
            <resultado>30-20</resultado>
        </partido>
        <partido equipo1="3" equipo2="4">
            <resultado>30-20</resultado>
        </partido>
        <partido equipo1="3" equipo2="4">
            <resultado>30-20</resultado>
        </partido>
        <partido equipo1="3" equipo2="4">
            <resultado>30-20</resultado>
        </partido>
    </jornada>
</liga>
